{
  "$schema": "https://json-schema.org/draft/2020-12/schema",
  "title": "studio-v1 style",
  "type": "object",
  "properties": {
    "style_id": {
      "type": "string",
      "pattern": "^[a-z0-9][a-z0-9_-]*$"
    },
    "revision": {
      "type": "integer",
      "minimum": 1
    },
    "reference_paths": {
      "type": "array",
      "items": {
        "type": "string"
      }
    },
    "camera_defaults": {
      "type": "object"
    },
    "palette_srgb": {
      "type": "object"
    },
    "materials": {
      "type": "object"
    },
    "typography": {
      "type": "object"
    },
    "safe_rect_normalized": {
      "type": "array",
      "items": {
        "type": "number"
      },
      "minItems": 4,
      "maxItems": 4
    },
    "label_slots": {
      "type": "object"
    },
    "audio_defaults": {
      "type": "object"
    },
    "captions": {
      "type": "object",
      "additionalProperties": false,
      "description": "The subtitle look (studio/edit.py CAPTION_DEFAULTS: a value left out keeps the default look)",
      "properties": {
        "size_frac": {
          "type": "number",
          "exclusiveMinimum": 0,
          "maximum": 0.12,
          "description": "font size / frame width (default 0.039)"
        },
        "letter_height": {
          "type": ["number", "null"],
          "exclusiveMinimum": 0,
          "maximum": 0.12,
          "description": "the letters' ink height / frame height, chosen against a measure of the reference; when set it decides the size (studio/edit.caption_font)"
        },
        "evidence": {
          "type": ["string", "null"],
          "description": "the measure letter_height was chosen against, in words"
        },
        "color_srgb": {
          "type": "array",
          "items": {
            "type": "number",
            "minimum": 0,
            "maximum": 1
          },
          "minItems": 3,
          "maxItems": 3
        },
        "outline_srgb": {
          "type": "array",
          "items": {
            "type": "number",
            "minimum": 0,
            "maximum": 1
          },
          "minItems": 3,
          "maxItems": 3
        },
        "outline_frac": {
          "type": "number",
          "minimum": 0,
          "maximum": 0.02,
          "description": "glyph outline / frame width (default 0: none)"
        },
        "panel": {
          "enum": [
            "rounded",
            "none"
          ],
          "description": "rounded (default): a dark panel behind the text; none: bare text (give it an outline)"
        },
        "panel_srgb": {
          "type": "array",
          "items": {
            "type": "number",
            "minimum": 0,
            "maximum": 1
          },
          "minItems": 3,
          "maxItems": 3
        },
        "panel_alpha": {
          "type": "number",
          "minimum": 0,
          "maximum": 1
        },
        "scratch_badge": {
          "type": "boolean",
          "description": "draw 'SCRATCH VOICE' on frames while the voice is scratch (default true); deliver refuses a scratch voice either way"
        }
      }
    },
    "world": {
      "type": "object",
      "properties": {
        "hdri_asset_id": {
          "type": [
            "string",
            "null"
          ]
        },
        "hide_from_camera": {
          "type": "boolean"
        }
      }
    },
    "light_rig": {
      "type": "object",
      "properties": {
        "preset": {
          "type": [
            "string",
            "null"
          ]
        },
        "exposure_ev": {
          "type": [
            "number",
            "null"
          ]
        },
        "white_balance_k": {
          "type": [
            "number",
            "null"
          ]
        },
        "hdri_rotation_deg": {
          "type": "number"
        }
      }
    },
    "look": {
      "type": "object",
      "properties": {
        "preset": {
          "type": "string",
          "pattern": "^[a-z][a-z0-9_]*$"
        },
        "passes": {
          "type": "object"
        },
        "compositor": {
          "type": [
            "string",
            "null"
          ]
        },
        "look_style": {
          "type": "string",
          "pattern": "^[a-z][a-z0-9_]*$",
          "description": "library/look_styles/<name>: advisory density/brightness check of renders and generated clips (look style check)"
        },
        "composition_style": {
          "type": "string",
          "pattern": "^[a-z0-9][a-z0-9_-]*$"
        }
      },
      "additionalProperties": false
    },
    "title_safe_rect_normalized": {
      "type": "array",
      "items": {
        "type": "number",
        "minimum": 0,
        "maximum": 1
      },
      "minItems": 4,
      "maxItems": 4,
      "description": "x_min, y_min, x_max, y_max of the critical text zone titles must stay inside (default .11 .14 .89 .65)"
    }
  },
  "required": [
    "style_id",
    "revision",
    "reference_paths",
    "camera_defaults",
    "palette_srgb",
    "world",
    "light_rig",
    "materials",
    "typography",
    "safe_rect_normalized",
    "label_slots",
    "audio_defaults"
  ],
  "additionalProperties": false
}
